title,id,body
I’m pretty sure I convinced myself I have tinnitus,pvkd77,"Yeah, I think I convinced myself I’m hearing a sound. My hearing is great, I’ve had multiple tests done and all of them came back fine. The more I look into tinnitus, the more I hear this sound even though I don’t have damage to my ears according to the doctor. Anyone else ever convince yourself you have something even though tests prove otherwise? 🥴"
Is anyone else getting super frustrated and tired of constantly feeling like your friends hate you?,pv9fyd,"Hey guys, I’ve suffered with anxiety for years and above panic attacks above everything my biggest frustration is constantly feeling like my friends hate me or don’t like me 

If they respond weirdly or don’t use the usual emoji’s my mind instantly goes to they hate me. It’s made even worse by the fact that I always rant to them about things and I’m always scared they’re getting tired of me. 
It’s becoming so unbearable I can’t handle it anymore. The worst part of my anxiety at lest is believing the whole world and your loved ones are against you, even if they aren’t 

Anyone got any advice?"
Breathing,pvk3ik,"Hello, 

When I have anxiety I sort of feel like I am gonna faint / have low blood pressure. Like, when my anxiety is at its worst, I have to lie down and put my raise my legs.

The thing is that I do not know how to breathe properly to avoid it since I do not know if I am missing oxygen or if I have breathing to much.....

Also, wearing a mask makes it worse because I feel like I can't breathe normally and it makes me focus on it.

What do you guys think ?"
Paranoid.,pvjxsj,"I found a post on kiwifarms. I don't use that website, I don't frequent those types of communities. They found someone by aligning what little pictures the person posted. The reflection off of certain items. It... was a lot. It was scary. It made me so paranoid. It reminded me of that man who found a Japanese idol from the reflection of her eyeballs. 

My anxiety is going nuts. I never want to gain a following. I want to go off the grid. I'm just spiraling."
Twitch in my ear,pvjwbb,"Hello! Ever noticed how sometimes a random muscle, or your eye lids just have a random twitch during the day? Like an erratic pulse. Well, I've been having that on my eyes, mostly the left eye, but also in my left ear. I suppose the eye twitch means I'm tired, which would make sense.. But what about the twitch feeling inside my ear? Anything to be worried about?"
Work Related Anxiety,pvjqhy,"I’m not sure if this is the right place to say this but here goes nothing.. 
Recently, I have moved into a new apartment and am a full time college student. When I first moved in, of course it was hard leaving my family, but I was pretty much at peace. Since then, I have become more and more busy with school assignments to the point where all i do is work. I want to take time for myself to just enjoy life again like before but don’t know how. Also, I now despise the apartment and constantly want to go home to my family. 
Any advice is greatly appreciated and God bless."
Panic attack,pvjmyv,"I think I'm having a panic attack right now, what should I do? I can't catch my breath, I'm scared! My head feels so light and I feel out of touch"
I think I'm going crazy,pvjefh,"I had a very vivid hallucination I think last night. Something was trying to pull me out if my head. Like imagine a dementor sucking your soul out. Except I couldn't move my body or ask for help. It happened four times in total. My head feels like mush. It's constantly vibrating. I'm scared. I'm scared I've either gone crazy or have some sort of spirit trying to take me. 
 I Know it's probably the first but I've had so many paranormal experiences that other people have seen    
  I've had seizures before but this feels different. I can't move. I can't ask for help. I just stay there and hover over my body. Should I try and find a doctor for this or am I just being silly? 
 I don't want to die like this."
Just need to share how I'm feeling,pvj94l,"I just moved to a new city several states away from where I've been living for the last 3 years. I had been feeling relatively stable the last year until the last couple months during which I went through some major changes including a breakup (from a pretty toxic person), and now a change of job and residence. I've only been in my new apartment for a couple of weeks so I'm still adjusting, but it's been tough to lose my routine and support network that I had. I don't really know anyone here and I don't start my new job for a few more weeks. All the change and the loneliness has caused my depression and anxiety to return with a vengeance and I'm feeling overwhelmed. Because I'm in a different state and now have different insurance, I will have to find a new psychiatrist and therapist after working with the same people for about 5 years. I'm struggling because as you'd probably expect, at a time when I need these resources more than usual, it's been harder to really get anything done including looking up psychiatrists/therapists and figuring out insurance. I know that it will eventually get better, as it has before, but that doesn't seem to make the present any less difficult. Anyway, I guess I just needed to express all this and hope I can get some support/positivity."
Is it normal to feel burning sensations at random parts of my body?,pvj8r0,
Non-THC CBD oil for anxiety,pvfbt3,"Looking for any recommendations of non-THC cbd oil items that have helped you with your anxiety. I suffer from extreme anxiety, and more often than not, it’s been debilitating and impacting my way of life.

I have started drinking 20-30mg CBD coffee and that has seemed to really help. I’m still learning about this, but would it be better to buy the oil itself and put it in food, drinks, etc?

I’m likely to end up being on medication once I’m able to see a psychiatrist (recommended by my therapist), but I would love to go organic before diving into medication (done it before but related to anti-depressants and didnt like the side effects)."
Does anyone have tinnitus or any chronic ear problems?,pv7q2s,"For like 10 months on and off I’ve been having ear issues. Chronic sore ear pain or stuffy ears 24/7. Crackling and popping when I swallow. And a thumping in my ear from the muscles. Also I’d wake up with slight tinnitus every morning that would get better as the day went by. Also sometimes I’d feel a pressure change in my ear and tinnitus would start up but would only last for like 30 seconds then go away. Lately I fell it’s been getting worse my ears not only hurt but feel more sensitive with loud sounds my ears vibrate now or crackle and sometimes I feel the muscle spasm in ear as well. I’ve been really depressed about this. I going to see a ENT I really can’t take this anymore, does anyone else have an issues like this?"
Its Hard to Breath,pvi9ep,"I've been having a lot of Anxiety,  I think I'm anxious every single day of my life. It's hard to deal with life. 
I'm extremely paranoid, I think it's A reflection of who I used to be. I just sometimes really wish I didn't exist."
New panic attacks,pve8js,"So I’ve been on propranolol for a week now, I’m not hyperventilating anymore which I suppose is good. But now instead of having the classic panic attacks, I’m just sort of riddled with periods of anxiety where my body will tense — tight chest or tight muscles elsewhere. 

Right now my body is so tense with anxiety, I can’t relax. It’s like I can’t release the feelings like a classic panic attack would. 

So annoying!"
Anxiety Feels Like a Trap,pvi5hk,"Recently, say the past few months, I have finally started to get my anxiety under control. However, today I probably had a little too much espresso so now I'm on high alert.

It feels like when my anxiety is high it's almost the same feeling when you are high or drunk and can't snap out it. Like when you are trapped in a room or a car. That feeling kills me. It's such a helpless feeling and you just have to sit in it. I'm getting better at sitting in it. Working though it. Learning from it. But when it happens it doesn't make it suck any less. 

Just really needed to vent this out into world. Going to go clean and take a shower and do some work because all of thag always seems to help. 

Thank God for reddit for so many reasons."
I hate getting flashbacks from things that i don’t want to remember.,pv859d,Does anyone know how I can forget about it
"Not sure if this is the correct sub for this but, I need help. I am always worried.",pvbgff," 

Hello. I am a 15-years-old Introvert that also has social anxiety. So I have this one friend that is a good. Me and her have known each other for years now but have only started getting closer and started chatting alot (Keep in mind this entire story does not include anything that happened in real life it's only online). So slowly I started getting used to her because we chat alot so then my guard went down and I am not too much of an introvert with her. In chat. But at times I try to be friendly with her since she always makes me happy aswell. So usually when she sends me a picture of herself and asks what I think I try to support her and compliment her with compliments like You look cute, You have a nice smile and etc. But after doing that I always just get myself worried since I feel I am being too friendly which could be a problem since I don't want her to think I like her as anything other than just a really close friend since that's not my intention here. Also at times I could apologize for talking too much since I really enjoy talking to her but I wanna make sure I am in the good side by apologizing since I am worried something wrong happens. I also apologize alot if I do something wrong because once again I don't wanna lose her, her being my only closest friend who is a girl. But then I feel worried maybe apologizijg too much is annoying and it's just a never ending loop. I also usually take no time to reply to her which I heard isnt too good to do. But I am also quite worried since school starts soon for us and she also wanted to play games together but I am not really used to talking to girls since as said she is my only close friend who is a girl And I would be so much more of an introvert IRL or in a call. Since I don't wanna be too awkward. She is an introvert aswell but less than me. I just don't always know if she started hating me or not.. It's painful. Sorry for the long story, Help if you can."
Anxiety Attack,pvhwg9,"The other night I heard my mom and her boyfriend arguing through the walls of my house, he started to complain about me and then went off for about two-two and a half hours about everything that he hates and that everyone hates about me. I have diagnosed bipolar depression and anxiety and it felt like my emotions shut off after about 10 minutes of him yelling. And then after the fight my mom came into my room and tried to talk to me and my vision started to tunnel up and when I tried to speak it felt like my vocal chords were stuck, I lifted my hands from the keyboard and they started to go numb and I couldn't move them and when trying to close them it felt like all my blood was leaving my hands and they started to cramp up completely, I wasn't able to feel my skin or muscles, but I could feel my bones in my hands and my fingers. It was definitely the worst feeling I had ever felt. My mom explained to me that I was hyper-ventilating. I have to say it was very very scary and really put into perspective how your emotions can literally make you physically hurt and make you feel like you're dying. I'm posting to see if anyone has ever had this happens to them and if the feeling was the same?"
Anyone hearing voices talking bad about you? Any tip to make it stop?,pvhj1d,"Someone I know have this feeling that people are talking bad about him all the time, insulting him, criticizing his clothes or the way he clean the house or things like that. Suffering from anxiety and it goes all the way that he cannot go out of home anymore. 

When we are together, I don’t hear the same stuff, it’s just him, that’s why I think it’s just part of the anxiety. 

Anyone with similar experiences?
Any tip?"
If anyone has cardiophobia read this,pv4n49,"I suffer so badly with heart anxiety mainly because I get palpitations a lot. After having about 5 ecgs, chest x ray, a 7 day holter monitor and maybe 5/6 blood tests since the start of last year and being told it’s all anxiety related I started to take upon myself to do some light exercise. 

With the encouragement of my counsellor and boyfriend, I started doing walks. It was only for 3 mins at first, then 5, then 7/8 and then I walked 1.09km this morning which was amazing for me. It took 12:56 minutes. I had a smart watch on me and started using it on my walks and all along my heart rate was normal and not going so high (I thought all along it was). Highest I think I seen it go on the walk was 140bpm. That’s so good for a 23 year old. 

I advise anyone that was like me fearing to even get their heart rate up. Start off small and build yourself up that’s what I did. Hope this helps someone 🤍"
Afraid of dying in sleep,pvhbpv,"So, I got my 2nd dose of covid-19 vaccine on the 23rd, I got moderna 
After I got it I noticed some weird heart rhythm, it cause me anxiety but it was gone the next day
Today I’ve had minor chest pains, and now as I was about to fall asleep I felt my heart slow down and i immediately thought that I will now die in my sleep
Could this happen? Or is it just my anxiety messing w me? Should I get a doctor or is it nothing to worry about?
Thankful for answers"
Laying in bed all day again,pvh8fv,My anxiety and lack of motivation has been so bad lately the only place I feel some relief is just laying in bed. My wife is out of town today so it is just me and the kids. They keep asking when I am getting up and I am telling them that I’m just not feeling great today. Feeling pretty ashamed.
Derealization,pvco0g,"Any tips on how to get out of a huge derealization phase? I’ve been in it for WEEKS, and I can’t get out. I have moments where I feel (somewhat) normal but for the most part, all day everyday feels like I’m in a simulation lol. I’m a mom too so I NEED to figure this out. It makes me feel so out of it, with no motivation to do anything like cleaning the house, going to the gym, or doing anything with my son. And it causes me to spiral into a huge panic attack that will last almost all day because of the feeling it gives me. 

I’m also on Zoloft 50 mg a day, this has been happening since before that though. Please help me feel normal again. 🥺"
I'm worried I'll never overcome agoraphobia. Feeling down & looking for advice/support.,pv6rhw,"So I bought a book the other day that use low-intensity CBT techniques to treat agoraphobia. I've been slowly working through it and I'm feeling positive but it's only been a week & things take time.

Today I was supposed to attend a family gathering but even with taking my anxiety meds (which usually help), I still couldn't leave my house.

I just don't know how I’m going to move on from this current state of anxiousness. I used to be a relatively social person who’d study, go to work, see my friends regularly, travel by myself & take random trips to places.

Three years later (i.e. Now) I’m a shell of myself, I have no friends, I can’t work due to anxiety & other MH conditions & my future doesn’t look bright if this continues.

If anyone’s reading this who’s overcome agoraphobia, how did you do it? Do you have any advice?

Thanks in advance!"
Vaccine anxiety (not COVID related),pvgart,"So I grew up anti-vax. And so as an adult (33), I still am not vaccinated. I did my research and personally stopped being anti-vax about 8-10 years ago, but never got around to getting my shots up to date.

It’s a combo of things: fear of needles, and the ingrained fear of adverse reactions - plus having a history of weird and rare adverse reactions to different medications.

Well, I’ve finally hit the bullet and have an appointment to begin the modified adult vaccination schedule. And I’m super anxious about it. It’ll be in about 1.5 weeks.

The only vaccine I’ve had is the COVID vaccine (signed up the day I became eligible), and didn’t have too bad a reaction (worst in the household, but all normal). I did have multiple anxiety attacks surrounding them, though.

Just worried about it, and know I’m going to start having worse anxiety attacks the closer I get."
"My heart rate is high but my blood pressure is low, can I still take propranolol before presentations?",pvg6kk,"
What’s the worst thing that could happen? 

I will definitely go to a doctor and ask but I’m looking for general answers and opinions online before I go."
Doubtful about taking Alprazolam for my anxiety/panic attacks.,pvfo2k,"I need some help, advises from people that actually used xanax as a medical treatment for anxiety and panic attacks / and major fear of throwing up in public, and not for recreational usage. (Sorry for my english not my main language)

&#x200B;

So  trying to keep the story short and focus on the issue, I have a mild level of agoraphobia which usually starts when I go out, after few hours Im mostly alright with barely any anxiety/panic attacks but the first hours outside its really bad, with panic attacks, breathing, the sensation of the heart pounding and the worst feeling that is nauseas and sometimes when its really bad throwing up.

I went to a psychiatrist which I dont feel he was quite professional it was a 10 min appointment in which he reccomended me to take

Vortioxetine 15mg one before a meal

Alprazolam 1/2 mg 3 times a day.

When I read the diagnose I felt it was really strong for my case. Im depressed but I do not believe I have a major depressión, on the other hand my panic attacks I understand needing some sort of pills for that but not sure if thats a good start, 3 times a day.

&#x200B;

Anyway I contacted another doctor which he reccomended starting on alprazolam 1/2 mg one  before going to sleep  (Im really curious if anybody knows that taking one alprazolam before going to sleep helps the anxiety of the next day when going out?) and having one pill on my backpack anywhere I go just in case, and leaving aside the anttidepressant until I start therapy and see how major is my depression.

Any answers with some personal experience or medical experience will truly help me out making a choice about this, Im rather desperate and I need to make a choice soon.

&#x200B;

I do want to start the alprazolam choice using the option of one before going to sleep to help next day anxiety going out, but Im a bit scared about the addiction and side effects of it."
Is there any way to stop this?,pvf9li,"Yeah. Anxiety. It's ruining my life. So here's the deal; I got an offer to go on a little vacation for free for a few days. (Going out of state to spend a few days with my boyfriend and his family) And I get to decide when I want to do this. All I have to do is say the word. Now anyone would probably love an opportunity like that, but my anxiety prevents me from being excited/happy about this.

I really do want to go badly, but guess what? My anxiety causes physical problems, so bad to the point I shut down and cannot even communicate for the life of me. Yep, you read right. I literally mentally shut down like a robot. Then I can't stop shaking, feeling like I'll hurl, get diarrhea, stomach pain. Ugh, my stomach just goes crazy. And it's like that the ENTIRE trip. I get no break. I end up having the worst time of my life. I'm even sick just thinking about this vacation. 

It does it no matter what I do... I can go to the grocery store or talk on the phone/video chat and get sick from the anxiety of it. I was so excited to finally get to go the beach this summer and I ended getting sick on the beach from the anxiety... and the main problem is the diarrhea. And it just causes MORE anxiety. 

It's been like this since I was a little kid, but recently it got worse. It used to be I just FELT like I had to go to the bathroom, but now I actually get diarrhea and feel like absolute garbage during and for days after the trip.

And I already have stomach problems all the time... but the stomach issues is making my anxiety much worse... and vice versa. 

I just don't know what to do anymore... I want to do things, go on vacations, or even just do something as simple as going to a store without getting sick af... I'm fed up. And I don't even know where to begin to help/stop this? PLEASE. PLEASE. If anyone has gone through this and has an effective way to help, PLEASE share! I want to take back control of my life and not constantly live in a state of fear and anxiety. 



(I also do not know the cause of it... I'm not even scared of people? My thoughts are not even running wild, I just get physically sick from it? It's weird. It's like subconscious anxiety. Even if I don't think about it.)



((And PLEASE for the love of God, do NOT tell me to get a therapist. I'm so fed up with hearing that...)"
Anxiety advice,pvf2cn,"I’ve had bad anxiety from being a small kid. Like random panic attacks in public, troubles in school because I didn’t know how to act around people or if they felt the same way. Over the years, I’ve learned to control my anxiety in different ways and dealt with the fact that it will probably never leave me fully. 

The last year has been great. I got rid of people who caused me stress, making my anxiety 100x worse, I started a degree, I’ve met someone. But it just comes trickling back like it sees you’re happy and needs to destroy that. Over the past few weeks, I’ve felt my self slipping and had the occasional bad day here in there. But tonight I’ve had a full blown, manic, breathless panic attack and I’m not sure where to go from here. 

I’m so stubborn to the fact that I need help and taking tablets etc will help me but I just feel like once you go down that road, you’re acknowledging that you’re not good and it’s acceptance. 

I’ve tried meditation, yoga, that calm app thing. I have hobbies and pastimes that allow me some escape but I just want to feel good again. Stress free, love myself again. Help me."
Jury duty,pvem2s,I have jury duty Monday and I’m anxious af about it! God help me!
Does anyone else get bursts of energy where they can power through a bunch of “scary” things at once?,puuxof,"My anxiety has gotten better over the years, but I still let “scary” things pile up and then get more anxious about them the more I let them build (y’all know how it is!) But, once in a while, I will get a burst of confidence and knock five things off my scary list at once. For example, the other day I set up a doctors appointment, resolved something with my pharmacy, submitted a maintenance ticket, got an estimate for a car repair, opened an email I had been avoiding, and dug into an intimidating project at work. That’s more than I can typically handle in a month. Does anyone else get this? Is there a way to harness the power?"
