title,id,body
"Anyone get anxiety about the fear of not being able to fall asleep, thereby, creating insomnia?",pvimxy,"This is a wonderful new thing I've developed . Its really frustrating me . I know that insomnia is typically temporary but lately every night I'm having legit panic attacks over not being able to fall asleep which will keep me up. It doesn't help that I'm hella jet lagged ( La to Barcelona). 

I just wanted to tell someone. Thanks for reading ."
I’m so sick of health anxiety,pvwyk5,"My throat feels slightly itchy is it allergies? Dust? Or  something worse 

Who knows but im panicking"
Sporadic Headaches,pvwtkg,Have anyone experienced unilateral tremors with sporadic headaches now and then with Anxiety on the left side of the head mainly?other times it would feel like a tight band on around the forehead(does not happen frequently)
Feeling of being incapable of things - proactively sabotage myself and want to abandon pursuits,pvwndx,"There's an instinctive feeling inside of me that i cannot do it, even though I know I'm a capable and intelligent person. I don't know if I've ever really tried as a result as I tend to just abandon things/rationalize not pursuing then further, even though I worry about and desire to achieve something so much. (also have a lot of traits of adhd/hyperactivity) Any advice / insights you can share on this? Thank you!"
Symptoms weeks after? Please help,pw0vo0,"Hello everyone! I have been a Hypochondriac for a while… always googling my symptoms and believing I have it…. Long story short, in August I tried some edibles and a few hours later had my first ever panic attack… went to the hospital as I thought I had a stroke or something… they told me was a panic attack, and it continued every few days until about 2 weeks ago… since last month, I still feel parathesia around my body(tingles,burning etc). Even went to a Neurologist who conducted all the tests :( can symptoms last this long after panic attacks, and when my body was high on anxiety? I am still googling symptoms and coming up with new problems… 🥺 right now I am having jaw issues(TMJ), headaches, tense muscles and tingling and parathesia all over my body… was diagnosed by my Neuro with BFS(Benign Fesiculation Syndrome), as some of my body just twitches randomly.."
"Very Thirsty, no appetite",pw0us7,"Am struggling with anxiety the last week due to a tinnitus flare up. I’ve also become sensitive to low-moderate level safe decibel noise in a way I never have been. It’s freaking me out and I’m likely still 10+ days from seeing a doctor unless my appointment gets moved up. A total of 20 days between onset of symptoms and seeing doctor. Seems like a long time and Ifeel like time is running short. 

Meanwhile, anxiety has come back full force worrying I’m losing hearing, on the verge of going fully deaf, etc. I’ve been very thirsty no matter how much I drink. I’ve also had very little appetite and basically force myself to eat. When eating mouth becomes very dry and swallowing is hard, almost like my body is trying to reject food. Why is this?"
Can constant stress and anxiety effect your head daily?,pvtzdf,"My head seems to feel woozy and a little lightheaded/dizzy often. I get allot of tension headaches back of my neck/head temples and eyes. When the headache isn’t there i still think the tension is still there lingering. Maybe that’s what is making my head feel the way it does. When i go out for walks or shops or anything like that my head feels like it’s on another plant, when i close my eyes it feels like my head is working 1000 miles an hour if you get me prob giving me that slight dizzy feeling. Looking to go on tablets tomorrow so hopefully it’ll get better and i also start my CBT soon too. Felt this way for years makes me not want to go out. I suffer bad with health anxiety, socials anxiety and just GAD in general"
Anxiety with working,pw0mxj,"My anxiety prevents me from working and getting a job. I’m 20 and have never had a job. Not having a job was never a problem since I was always active in sports that consumed 6-7 days of each week, so I never had the opportunity. In the summers, I still would row and go to regattas but I also loved having time away from school and sports in the summer and used that time for vacations and having fun. 

I’m now in my sophomore year of college and have only 2 in person classes on Tuesdays and Thursdays, the rest I opted for online. I have a lot of down time that I try to fill with seeing my boyfriend but he also works, so it’s not always as much as I’d want to. I already miss him a lot when we’re apart so I know I need to be more proactive. I’ve started back at the gym a bit which was hard and still is but I want to get into a groove and be healthier, body and mind. 

In august, I got my first job at a gym at the front desk and working with kids. It was okay and my anxiety was very prevalent, but I managed the best I could. I ended up quitting after a week after having a male coworker constantly flirt and grab my waist as a way to funnily scare me, which it wasn’t at all. Instead of being upfront about my reasonings, I told my boss that I found a better job that was in my career path and needed to take it. In hindsight, I should’ve told the truth because no coworker should treat another coworker the way I was being constantly uncomfortable. This solidified my fears to not work and I just can’t see myself with a job like that yet. 

I’m in school to be a young kids teacher which I know won’t give me much anxiety since I love children but all the jobs available to me are ones I am not interested in and give me a lot of anxiety thinking about it. I’ve tried daycares but because I’m a student and can’t work full time, they can’t hire me. Babysitting is always too sporadic when I’d rather have a set schedule and nannying conflicts with my schooling. 

Right now, I would love to have a remote job since that’s all I feel I could manage right now. I know I also need to be saving money since there’s so much I want to achieve in life but I feel incapable. I’m working on improving my mental health but I know it’ll be a slow process so until then I guess a job that doesn’t require much seems the best to me.

I live at home still so I’m reliant upon my parents for everything and when I’m with my boyfriend, I’m reliant on him for things too. I don’t want to feel like a burden to people anymore and I want to be more self sufficient since the plan is to rent an apartment off campus either next semester or my junior year. Since I am fortunate enough that my parents can provide that for me, I want to prove to them that I can also provide for myself and make my own money but I genuinely don’t feel ready for a real job. 

If anyone has any jobs that are low anxiety jobs or ones that I can start online I would greatly appreciate it!! Just needed to vent and maybe get some advice :)"
"I just need to hear that i can do this and everything will be ok, maybe some advice please!",pw0hoi,"I'm in the process of helping my elderly, disabled dad move. He's not allowed to bring his cat with him to where he is moving, so i am taking her.

I have always been a cat lover and I've wanted a cat again for years. I've held off though because I've been raising a family and i didn't want to bring a cat home to 2 toddler girls who would absolutely love the cat, but might stress her out. She's used to living in a quiet retirement community and my house is the typical toddler household still. My girls are currently 3 and 4.

I'm having a TON of anxiety over bringing the cat home. I'm worried I'm going to ruin this cats nerves. When my dad first brought her home with him all she did was hide and run from every noise. It took her months to get fully comfortable and she's still not fond of strangers. My kids aren't strangers to her, and she's ok with them when they're calm. But when the kids get rowdy the cat gets scarce.

We can't find another better home for her right now. I don't feel comfortable taking her to the shelter, i love her. I've talked to my kids as much as you can about it to a 3 and 4 year old. They are excited to have her. 

Do you think she will adjust? She's 5 now. She likes affection. She just doesn't like noise. My house isn't that big, its just one floor of an average sized house. Do you think she will do ok? Does anybody have any tips on helping the cat adjust? Or am i overreacting because of my anxiety?"
Question about clonazepam,pw0frz,"hello! i am taking 0.75mg of clonazepam daily (3/4 of a 1mg pill) along with 100mg of sertraline. My doctor prescribed me to take 0.25mg of clonazepam with each meal (3 times a day) to make the 0.75mg, but i often forget and decided to take the entire dose at night. I have never had trouble with side effects or addiction (in fact i forget to take them at all sometimes) so my question is: does the way i take my medication matter in the effect it has on me? would it be different if i did take 1/4 pill throught the day instead of all at once at night???

i really hope this made sense 🤧🤧🤧 and thank you!!!"
Why is it that everytime i try to avoid stuff that i KNOW will make me depressed/angry/etc. i get anxious?,pvw6io,"This is a bit complicated to explain, but here's an example: let's say i'm in love with this guy and he gets a girlfriend. My friends find out and tell me. Obviously i'll be hurt but if i go to his instagram and see their pictures together, it'd hurt me even more, right? So you think ""well, just don't go to their instagram then"" and that's the thing. When i start trying to avoid something that i don't wanna see, i start getting anxious about it and i have no clue why. The anxiety only goes away after i do whatever i've been avoiding. It's like my brain WANTS me to see it and get hurt so it can be at peace afterwards for some reason??
 
What prompted me to ask this is that youtube keeps recommending me this video about a topic that i know will get me angry (specially if i go to the comment section) so i'm avoiding it but now i'm anxious because of it. Part of me is like ""go and see it, someday you will anyway so you can just get it over with now"" but why when i can simply AVOID IT? Why won't my brain let me avoid stuff?? Does this happen with anyone else?"
Ditched,pw0bh1,I met up with someone from the app bumble bff for drinks and thought we hit it off well.  He mentioned hanging out again and introducing me to people in his life.  I texted him to hang out and he didn’t answer.  This was a day ago.  I’m feeling insecure like I’m not good enough for his company.  Feel rejected and like a loser.  Anyone there to help me to chill out?
Sporadic Severe Anxiety-Anyone else?,pw050e,"Hello!

Wanted to reach out and see if anyone else has had this experience… I don’t typically have major difficulties managing my anxiety and would describe the times I get stressed and slightly anxious as “normal” reactions to a stressful job, etc. 
however I have had 4-5 times, starting over the last two years, had extremely severe anxiety periods lasting for several days to a week. Up most of the night, heart racing, constantly thinking about what could go wrong, etc. It usually improves once I get more sleep and I can go months and months without experiencing it again. But like I said, when I do experience it, it is above and beyond. I can barely function and am at like a 10 the whole day and night.It seems to surround transitions in my life. Anyone else have a similar experience?? Even my therapist was a little mystified that it comes and goes sporadically but so intensely."
First time that I have cried for two hours straight,pvt7gj,"The title says it all, been a rough few weeks and today I hit the absolute rock bottom"
Do antidepressant withdrawl peak after a week of it starting,pvvhnz,I started to get withdrawl last week and I mean last 2 days have gotten worse but today better they feel like they peaked within days
infatuation: self destruction,pvzltp,"i've been talking to a girl on for a few days via dating app, and i'm just a mess right now.  
infatuation has always been so horrible to me.  i feel on the verge of crying. and feel so pathetic.   
i just feel like blocking her, because its too much.   


i have told her how i feel, and she said ""well, what's the worst that can happened. we can just be friends"" but i just don't want that, and rather i didn't know her now."
Near constant chest pain,pvzlcz,"So, for the last three or four days I've been having some really frustrating chest pain/pressure that only goes away when I'm completely distracted from it. It doesn't matter what I'm thinking about, if I'm not fully focused, this pressure makes itself known. I went to the ER, and they did an x-ray, EKG, blood test, etc., but they didn't find any problems and said it's likely due to my panic/anxiety disorders.
The thing is though, this is pretty new to me. While I've had chest pain due to a panic attack or anxiety, it's never lasted this long, or been this bad, and it's making it even harder to function than normal.
What I'm wondering is if anything has similar symptoms, and if they have any suggestions to cope or even help relieve the pain I'm feeling.
(Important to note, I'm not currently on any medication other than mood stabilizers due to problems with insurance, and until that's fixed, I'm unfortunately on my own)

TL;DR: Having near constant chest pain/pressure due to anxiety/panic disorder, and it isn't caused by any underlying heart problems - looking for people with similar symptoms and advice."
"Grocery store anxiety, I have it bad",pvq2cx,"too much ppl, the crowd but cashiers triggers my anxiety so much. my heart goes through the roof when im checking out, sweating like balls. 

so i been using self checkouts but it still triggers my anxiety. all those cameras monitoring my every move. it freaks me out and gives me so much anxiety"
Awful family makes you awful,pvn8fl,"For 24 years, I had been raised under tiger parenting, mistreated day & night. It wasn't until I resettled alone in Britain following so many blood & tears when I realize what freedom really is. 

Indeed, it's hard to know what freedom is unless you've lost or gained it, either way. 

Having grown up in a hostile environment with little love & empathy from nasty family members cost my faith in mankind. No matter how articulate I can be in normal conversations, I've never found trusting anyone easy. There always seems to be a conspiracy against me. 

Never has a day passed without terror. It's out of myself. I feel I'm affecting those who I deal with. I'm very sorry for that. 

I like socializing, but sometimes locking thyself in a room fares better than hanging out, doesn't it ? 

Girlfriend? No, never, I can never trust. Be myself is too tough & so wasting my life may be the necessary evil. I'm still 24. There are lots of g**d***ed stuff I've neither enjoyed nor had the capacity for it, have I ?"
Does anyone with anxiety get that tense stomach thing,pvpjmv,"Like your stomach muscles tense up so much it hurts after awhile and you can't seem to relax it.


Feeds into my health anxiety which seems to make it worse"
Last night my heart rate was at 170 BPM while resting.,pvy1v3,Last night was absolutely terrifying and the first experience I’ve had with what I assume to be an anxiety attack. I came home around midnight after having some drinks with friends. I was feeling pretty tired so I took a quick shower and hopped into bed. Once in bed my mind started racing (as it usually does) so I tossed and turned a bit. I also noticed that my heart rate seemed to be a bit high (minor palpitations). I decided to get on my Reddit and mindlessly scroll since I couldn’t sleep. As I was scrolling on my phone I kept noticing my heart rate being elevated so I decided to get up and take some deep breaths. I began pacing around the room when the shit hit the fan. My heart rate kept going faster and faster and the more I tried to relax the worse it got. I began to panic so I woke my brother up (it was about 2am) thinking I might need to go to the ER. Immediately upon talking to him my HR came down to about 125 which is obviously still quite high. I spent the next 3 hours laying on the sofa and just trying to rest/relax. My heart rate for the remainder of the evening hovered around 100 BPM before eventually falling asleep. Fast forward today and I’m feeling pretty terrible. Anxiety is still high as I’m worried about last nights experience. A lot of questions going through my mind… was this purely anxiety induced or perhaps a medical issue with my heart? Is this going to happen again? Why did it happen last night for the first time if I’ve always had anxiety? Heart rate today is around 85 BPM which is within normal range but still high for me. Any advice/tips on what my next steps should be would be greatly appreciated. I’ve always had what I would describe as “manageable anxiety.” I’ve never taken medication for anxiety.
I have ton of anxiety about flying,pvy0rg,"I have a flight tomorrow and I already know how much hell it will be. I wish I could wake up one day and just be able to fly like a normal person. I can’t eat, I can’t sleep, and my heart is racing like crazy. Anyone else suffer with terrible anxiety while flying?"
I stopped my clonadine,pvxuo3,"I researched it and

 1) I already have a heart rhythm problem so I should *not* be taking this... I told my Dr about my heart already so this has lost some belief on them

2) if one month I don't have the money, I fucking die?

Goddamn this medicine has caused me anxiety. 

I guess I will call tomorrow and tell them I'm not taking this. I stopped over a week ago but I just have not not called yet. 

I just feel discouraged"
Fear of sleep,pvtmg1,"Hiii everyone, i’ve been struggling with an intense fear of falling asleep. Its been bad lately vomiting and panic attacks when i do start to get tired. 

Any advice?? :( thank you"
Hoping for peoples opinions on Clonidine,pvxlog," Dr suggested I try clonidine as him and I suspect I may have ADHD and can't afford to see a psych to get anything like a stimulant. He suggested I stop taking my propranolol (10mg 3x a day) as the Clonidine also acts as an antianxiety medication similar to propranolol. They both treat hypertension and I shouldn't be doubling up. 

I took the Clonidine that day and found it made me super drowsy, reminded me of a pain killer or something. Gave me a pretty good feeling but didn't seem to help my inattention at all. 

I'm interested in other people's experiences, does the drowsiness go away with further use? Did it make anyone else feel pretty good? Like they are on codeine or something?"
Anxiety & OCD Flare Up,pvxfsm,"I’ve been going through a “rough patch” with my anxiety and OCD especially with the intrusive thoughts. They mess me up the most because they’re things I DON’T want to do and scare the hell out of me which then causes my anxiety to turn on full force. I don’t like not feeling like me. I tend to be that happy and always laughing person and I thrive feeling that way. So, to constantly wake up and feel anxious and have my OCD throwing random intrusive thoughts in my head is terrifying. I’ve had a lot of changes since April that have been stressful. I work in veterinary medicine as a tech and we’ve been overrun and overworked lately and I’m a manager of the surgery department. People are constantly freaking out to me over issues lately. My boyfriend and I just moved into a house together in July which was a huge step. When I’ve done that in the past in relationships it’s never been a good time and I have PTSD from relationships. I don’t feel like my house is home yet. I’ve been petsitting back to back all summer and now that I’m finally home my boyfriend is traveling for work. I’m mentally drained from the pandemic I just want it to be over. My friends are all not in the best head space right now and my best friend is being super negative and dragging me down. 

BUT, I’ve made this changes currently. I’ve been seeing my therapist weekly for the past 6 weeks. I had an appt with my psychiatrist and he bumped up my lexapro and klonopin temporarily to help get me over this rough patch. I deleted Facebook so I wouldn’t have to see negative posts. I started a membership at a gym so I can run and work out some of this physical nervous energy I feel and stress from work. I’ve cut back on caffeine. 

Basically I’m just venting and want this rough patch to be over so I can go back to feeling myself again. Thanks for reading my rant if you did"
Surgery,pvx9cp,"Im 18 and my mother had to be taken in for a ruptured appendix yesterday and is having it done today with possibly a hysterectomy in the same anesthesia round. I couldn’t sleep at all tonight and I can’t go visit or ask considering the hospital is almost 30 miles away. Im scared out of my mind even though there haven’t been any immediate infections and her blood sugar was near perfect for the past couple of weeks. 

I can’t stop googling things and I feel so terribly helpless that it’s made my stomach sick. Has anyone else felt this bad?"
Job interview,pvpc6r,"I have a job interview in 2 days. It's perfect for me, ticks all the right boxes and would generally be a massive missed opportunity if I don't at least try. But I'm not ready. I quit my last job to get back on track with my mental health, and I haven't had enough time to get there yet. I only applied on a whim never believing I'd get an interview and now I've spent the last 4 days panicking. I have to do it or else I'll beat myself up about it and that'll get my anxiety going even more! I'm just not ready!"
Anxiety is killing all my pleasures,pvx5ga,"I am a 20 yo male, living in Europe, diagnosed with anxiety and moderate depression. I discovered my situation very recently, after a period in which an ever increasing amounts of bad thoughts started crossing my mind. I talked to my parents about this and I am now undergoing medication and counseling.

I used to be very different from what I am now. I used to travel, go out with friends quite often, go study in a library, stay at home alone for a few weeks without any fears. I used to love driving, making new experiences and so much more. Now I constantly have thoughts about something bad happening. I can't stay at home without thinking that there might be thieves wanting to enter my house or someone pointing a gun at me. I can't go and drive around without fearing that if someone were to cut me off and I honk at him, he might get out of the car and hurt me. I can't go out at night even with friends, because I am afraid that if I were to cross someone's eyes they might start a fight. I can't go to the car wash without thinking that someone will want to steal my car and do so in a violent way.

My situation is affecting me in so many different ways: I have a hard time studying, even though I have taken my mind off university for a whole month and I have selected courses I am really enjoying (I have never thought about leaving uni, getting a degree is just too important for me); I would love to get a motorcycle's license, but what's the point if then I am afraid to go out?; I rarely see my friends anymore and even though I explained this situation to them and my psychologist suggested to try and go out with them (which I have done very recently and I felt very well) I just can't imagine a return to a version of me without depression. I have always been anxious before taking a test or when doing something relevant for the first time, but this is way beyond anything I've ever felt. I am also extremely rational and I often read about how we're living in the safest period of human history, the world is getting safer year by year, the rate of homicides and wars is declining steadily. Reading this makes me feel good, but only for a very short period of time (minutes) whereas I used to have an extremely positive outlook about the world if I were to read the same information.

Has anyone felt the same way about these topics? How long will this go on? I want to take my life back. I read a lot of posts where people are anxious about public speaking, but almost none about being anxious of people's behavior like in my case. Thanks"
Random anxiety is the worst,pvnkr7,"Today i went out to eat and as soon as i got there i got this choking, dizzy feeling. I figured i was dehydrated, but here i am 6 hours later still feeling that way. Hopefully it’s just anxiety, but it’s still annoying."
Experiencing vertigo for the first time. Trying not to panic.,pvwk0w,I’m having vertigo for the first time in my life. I spoke with my mom and a nurse and they both assured me I’m not going to die and take it easy and relax. I’m still feeling very scared that something is gonna happen to me. Has anyone here ever has vertigo before?? What helped?
