title,id,body
So here we go again not a great sleep and got 2 stressful things to deal with today then another stressful thing tomorrow.,pwbpms,"I can't cope with any stressor and I've got 3 in two days, I'm just gonna have to battle.my way through it as best as I can what else can I do well aside from the obvious harm or just give up completely. I dunno gotta try ain't I even when I don't feel quite right quite here quite present. Still gotta keep going."
How do you get yourself through a job interview?,pwbphj,"I would like to consider myself mildly okay at containing my anxiety at this point in my life, but interviews are the bane of my existence. I have an interview in 2 1/2 days and while I'm grateful it's not in person, I despise talking on the phone.

Regardless, how have you guys gotten through interviews? For some reason it's one of those extremely hated things where I feel like I'm gonna throw up or stop breathing, like it's very bad. My usual tricks don't really work because I'm surrounded in an environment where I want to run but can't. I guess I just never knew how to confidently talk about myself while being very very judged while doing it."
Tips on how not always to assume the worst?,pwbn9a,"I am a current university student (I am also diagnosed with ADHD) so school is something that always stresses me out. I have a very challenging upcoming semester ahead of me and I’m ungodly nervous about it. I have talked with my therapist many times about how I have no reason to be afraid because I always do well in my classes in the past. But this feeling makes me wanna throw up. I always assume the worst in a lot of areas of my life (especially school) do to the fear of living the same life my parents did raising my siblings and I. We grew up in poverty and all my parents want me to do is not end up where they are. Any tips please? 

thank you."
Anxiety has increased since starting Zoloft again. I start a new job soon. What can I do?,pwbl0q,"Hey all, my doctor prescribed me 50 mg of Zoloft a few days ago. I wanted to start medication again because in even somewhat uncomfortable situations my heart beat speeds up, I get nauseous, and I visibly shake. I’m currently on day three of the medication, and my anxiety has increased a lot, even in situations that I normally wouldn’t be anxious in. I’ve never had a full blown panic attack but I felt like I was going to have one just trying to watch a movie in public today. The day before I almost skipped lunch because the idea of talking to a drive thru cashier made me start shaking.

I’ve been on Zoloft before years ago. I think my doctor started me on 25 mg before moving me up to 100 and I didn’t feel any side effects ever.

I want to try and feel better as soon as possible, and I know the side effects can last a week or so. Should I lower to 25mg? That being said, I don’t want my original symptoms to come back either. Or would I benefit more from staying at 50.

I start a new job in a week and the idea of being a nauseous shaky mess makes me even more anxious."
"undiagnosed, this last week has been an absolute nightmare",pw65jy,"i’ve never been particularly anxious but ever since i started my second year of uni and still being confused about my future has been so stressful. i can barely sleep into 6am, i’m constantly overthinking, my heart rate is extremely fast and my nicotine dependency is coming back. i’ve also been crying over the dumbest things for the last 3 nights and it goes on for hours. i got fired from my job yesterday and that was the icing on the cake for me, i’ve been in a constant state of panic and fear even though i was able to snag another job within a day. now im terrified about this new one— i’ve already lost a minimum wage job so i feel like a major loser, what happens if i lose this one too? what if i can’t keep up with the hours and balance school? what if i do poorly in school? does anyone have any advice on how to deal with these new emotions? im so scared"
Overthinking,pwb2pv,"Said something kinda invalidating of someone else’s experience, I think just trying to relate and find connection, but immediately regretted it . Not a close person in my life , but strong urge to apologize and correct myself . Wondering if it would be for me tho, and not for them.."
"Ate some chicken that tasted funny, currently panicking",pw7p3g,"I ordered chicken soup from my favorite pho place tonight. I noticed after a few bites that it tasted kind of off, but I ignored it at first thinking it was too much cilantro. Pretty soon I realized it was the chicken that tasted and smelled weird. I hadn't put all of it into the soup yet, and I tried to take out the pieces that were left in there and just eat the noodles and veggies. 

Now I'm wondering why I didn't just toss the whole thing. I ate some of that chicken and drank the broth it was in. I'm so scared I'm going to get food poisoning that I actually tried to make myself sick earlier. I've always had issues with health anxiety. 

Has anyone been through this? Did it end up being okay? I'm so afraid."
Little wins,pvvl0r,"I just won a little battle with anxiety today! My anxiety is generalised but mostly stems from severe emetophobia, to the point where I often struggle to leave the house in case I suddenly get sick while away from my safe space. Today I took the dog for a walk, on my own. I took her down to the beach, let her off the lead (I never do this unless my husband is with me because I'm terrified she will run off) and walked her for over an hour. We did the whole beach, through the cliffside gardens and I only put her back on the lead when we got onto the streets. Also, I didn't take my anti-emetics with me. Feeling very proud of myself. F*** you anxiety!"
Anxiety and being shirtless,pwarrz,"Hey all I’m a guy in my mid 20’s. How do you get over general/social anxiety and being shirtless around people?

I have one housemate (a girl around my age, we met a couple months ago). When I’m home alone I like to just chill shirtless, I sleep shirtless, fine swimming or being at the beach shirtless. But it’s getting warmer and I’d like to be more comfortable just being shirtless at home, or after a run or workout or whatever. Is that weird? How can I get more comfortable with that?"
What jobs work best for anxiety?,pw0stg,"I'm working as a cook at a restaurant right now (the owner is a family friend which is the only reason I'm comfortable there), but I'm trying to find a REMOTE job so I can have more flexibility with where I'm located. 

But every time I look at job listings I start bawling, because
1. Dont feel like I can do it
2. ""Must be able to work well under pressure and in a fast-paced environment""
3. Nothing looks interesting

So...is there anyone here that has been successful finding a good remote job that works well with anxiety? And how did you find it?

I have a bachelors degree in communication, but only very amateur experience in anything :/"
Literally haven’t had a good week in a month…getting my wisdom teeth pulled made it all worse. My stomach can’t handle this🥺 my anxiety is through the roof.,pwae8s,
I love the feeling of battling through anxiety and getting that feeling of relief after you beat it,pvvlmv,
Fear of being drugged or poisoned???,pwa59i,I just wanted to know if anybody else has an irrational fear of being drugged or poisoned. its so weird idk why its gotten this bad. say you go to a gas station and the bags of chips are lined up ill get the one in the middle thinking if somebody tampered with it it wouldnt be that one and that goes for anything. i recently had an anxiety attack because i touched the keypad to put in the pin for my debit card and i convinced myself it had lsd on it. it sounds ridiculous. i wont drink water bottles if i have left them out of my sight for too long. ill buy fast food and look at it and if i see something i dont liked i.e black speck i wont eat any of it i turn the water bottle cap when i buy them to make sure the seal hasnt been broken. i wont touch doorknobs or other house hold objects for the fear of drug residue on it ( my mother has recently gotten back on meth thats why but ive been like this beforehand ) i wont eat food in the fridge at my own home because i think its either drugged or poisoned. it didnt use to be this bad it just recently got this way. i dont know if this anxiety related but i get anxious about it. could anybody shed some light? what kind of help should i seek out to get rid of this. please anything.
If I don’t cheat I get anxiety.,pwicf5,"I get panic attacks when I'm not talking to multiple women at once. Like I can't sleep at night when there aren't at least two girls on my phone at once.

At one point in junior year I was with multiple girls at once. My friends used to joke I had a girl for each day of the week. Now, I am not “attractive”. There have been girls that found me to be attractive, but I’m not a ten, nine, or eight. Personally I’d say on a good day I’m a six. However, I just hit on women relentlessly. Like, if I don’t hit a certain quota by the end of the day, I feel bad. 

When I get rejected, I never really think about for more than ten seconds. Like it doesn't affect me and I just move on.

Ok, let me use an example, you know when you go to the gym, and then you leave the gym and you’re like “I could have stayed and done more” yeah, that feeling.

I can’t help it, if I don’t have at least three girls texting me at once, I feel anxious.

I want to ask my therapist if I’m a narcissist but I don’t want to at the same time.

The worst thing about all of this is, I enjoy making women cry for me. Like it feels so gratifying. Like you know that feel good after you do a good deed. Like that, I’ve fantasized about making women cry for me from a young age. Sometimes I’ll start random stuff just to make them cry."
Clonazepam and alcohol,pwa03f,"I went to party today around 5 and drank some wine and a shot of tequila but it never got me feeling tipsy or anything and stopped drinking at around maybe 7:30-8pm and around 12 am I felt my self getting anxious so I took half of a 0.5mg of clonazepam which was prescribed to me for moments when I feel an anxiety attack coming. I’m just kind of paranoid as I saw online that it was extremely dangerous to mix alcohol with this medication, but I completely forgot I had drank alcohol today as I just felt my anxiety come and I went straight to take the clonazepam, is everything fine or should I be worried about mixing the 2 in this situation?"
Wondering What On Earth Is Going On With Me (and if anyone else feels the same),pw6eb1,"hi! first time using reddit here.

I just wanted to share a bit of what goes on in my mind and see if anyone else relates because I try to google what might be going on with me but nothing feels 100% right.

My mind is always overthinking. I didn't even realize it until people starting calling me funny whenever I described my thought process. That also made me realize how much of a pessimist I am.

In most areas of my life, I'm perfectly fine. But when it comes to relationships and work, I get extremely stressed out to the point of spiraling. It could be mild, but other times it gets so intense that I'm unable to stay present and get really distant or the only way to make it stop is sleep. As I've recognized this pattern, it's gotten worse. A few days ago, I literally had to force myself to sleep to prevent myself from killing myself.

But this is the weird part, all of these spirals only last a couple days tops. And when they're over, either feel like I'm on cloud nine or stable but that's also only for a couple days tops. Sometimes the being distant thing goes on for a few weeks but that's it. Most of the time I feel like I'm living in a state where I'm neither happy nor sad nor empty, just cautiously living. I'm just so confused because all the anxiety and depression disorders seem to be constant but it's not for me, but when I am experiencing feels WAY too intense to be ""sadness"".

I should also mention that I can never be productive for more than a couple days. I'm either procrastinating and practically making myself think about anything other than what I should be doing. OR crunching because I'm mega stressed about the fact I should be doing something productive. Sometimes I'll even be stressed and still procrastinate.

I know that was a lot but I gotta know if anyone else relates or has any advice. Any thoughts are greatly appreciated."
Help please I don’t know how to make others understand,pw9wt4,"Help—Idk how to explain to my boyfriend what it’s like to have social anxiety and depression.  He’s a social butterfly and can’t understand why I am the way I am.  He gets so frustrated with me.  

Tonight, we went to a wedding where he was one of the groomsman and I was not in the wedding party.  I knew little to no people at this party so I was very uncomfortable but did my best to look cheery and happy.  I worked so hard to look comfortable and happy despite being deeply uncomfortable.  I showed up to the wedding at 4 and made it through the ceremony maintaining my composure. But at around 8pm this whole situation started to become too much for me.  

We were seated at the wedding party table and both went to the bathroom and when he came out he didn’t wait for me. Instead he went to go and mingle with friends.  I got out of the bathroom and looked for him but he was no where to be found.  The wedding planner told me to take a seat so the first dance could begin.  

I was back at the table directly behind the couple doing their first dancing with the rest of the wedding party sans boyfriend.  At this point I’m freaking out, everyone at the table is canoodling with their significant other during this romantic song and I’m just there.  Alone.  Trying to make it look like I belong and am super happy because I’m gonna be in the background of all of their photos.  I don’t know these people, I met them 2 days ago.   I finally spot my boyfriend and he has just standing across the floor laughing with his friends as I wave to him to come back to sit and he just stands there laughing with him friends.

After the first dance, I took my purse to go sit inside and compose myself.  I’m on the verge of crying at how awkward I feel.  My boyfriend follows me in and is mad at me about going inside.  I ask him to please leave me alone so I can put myself together but he is getting progressively more and more frustrated with me.     He says my feelings don’t make sense and I continuously say that he can’t understand how I’m feeling but please have some empathy and  don’t get mad at me.  I ask him to please leave me and go rejoin the wedding because he will be missed.  I even try to say maybe we can talk about this in the morning because we have been drinking. I really don’t want to ruin this wedding.  I’m just feeling overwhelmed plus I don’t want everyone to know that I have debilitating anxiety.. He will not leave me alone, he is the kind of person who wants to fix things right there.  He says I’m not explaining how I’m feeling and why and at this point I’m straight up balling because he is getting very frustrated at me.  I have no idea what to do.  

I don’t know how to explain to someone that doesn’t understand what it’s like to have anxiety and he can’t tell when I’m about to go into full on panic mode.  I try to tell in the moment when I’m feeling uncomfortable but he just thinks i can “power through” and then when I can’t he makes me feel bad about leaving the situation and says that i’m ruining the party.  How can I make him understand?"
Everywhere I go I feel like all eyes on me.,pw0ysd,Every movement is monitored and judged. I wish I could explain my actions. Explain why I do the things I do.  Please don't judge me. I can't stand the idea of someone looking down on me.  It paralyzes me.
Tips for freeway drive tommorow,pw9ndz,"Hi guys I am currently super nervous because I am driving an hour away on the freeway to go to the neurologist for my agoraphobia and panic disorder. At least my dad is driving so it will be a little better but I feel it’s going to be really rough

I was wondering if anyone has any tips for calming down my thoughts while on the freeway.

I fear not having off ramps available in long stretches of road and traffic.

My biggest fear is that I will become stuck in traffic and start to panic without a way to get home. I am also afraid that when I’m about 40ish minutes out I will panic because I know it’s a long way to get home. 

I think a big part of me still believes that panic can last forever and can hurt me and I still struggle with the thoughts immensely. 

Any tips or words of advice would be appreciated cause I am really nervous right now.

Thanks!"
Fear of kissing anybody,pw251t," I'm a 20/F and the other day I went to a party and this boy I liked was flirting with me, I knew that if I went with him alone he would try to kiss me and I panicked, my heart was beating super fast and I was extremely nervous, so basically I nicely refused to go on a walk with him. I regret that SO much, but at that moment I just shut down. Since then I have been uneasy and anxious I'm not sure why, I just feel bad that I couldn't pull myself together, I have never kissed anybody because any time there might be an opportunity I just sabotage it. I also lowkey feel ashamed of being this old and still haven't had my first kiss.

What should I do to improve my anxiousness:(("
Visualization techniques only bring scary thoughts.,pw9d4x,"Many of my therapists, psychiatrists, and favorite mental health resources have recommended visualization techniques to reduce my late-night anxiety that keeps me from going to sleep. However, whenever I start doing these exercises, my mind quickly goes to dark and scary thoughts, which can even cause panic attacks. What type of exercises can I try that don't require much mindfulness?"
Sore throat - contrast dye worried,pw9d1w,"Hello,

I have written this a couple days ago but I'm still worried. So, I got the CAT scan (CT scan) with contrast  on Thursday noon. I developed hives over it on Thursday night, which the doc thinks it's a delayed adverse reaction. I took Zyrtec and it went away.

The only thing I'm worried right now is the allergy coming back (cause I've heard it can still happen after a week). My throat is still dry, and I feel like something is inside my throat (like a sore throat). This sore throat started happening on Saturday, and it has been continuing for the last 24-30 hours. I'm not sure if it's getting worse because it has been staying the same.

I'm worried if this is an early symptom of an anaphylactic shock that could cause me not to breathe suddenly. Anyone that can help me out here?"
"Sleep paralysis: PLEASE tell me your personal experiences, details appreciated.",pw5n14,"What caused it, how often, triggers? Solutions? 

Basically over the last few months my body has been on off having sleep paralysis cycles. It’s exhausting and I want to get information before I take it further. 

Neurologist and sleep therapy + EEG in the near future."
Please I just need an advice,pw5kst,"For the past 4 months my life been full of anxiety and depression and stress since my dog passed away. Last Sunday I thought I had a heart attack while I was at my mothers house, but apparently it turned out and anxiety attack. I have never experienced anything like this before my heart was racing I felt my arms and my legs tingling and numb I was shacking uncontrollably. After going to ER they got my blood work and X-ray and EKG they didn’t find anything wrong. I went back home and I felt the same way again. After 3 days my stomach started to hurt me a lot like everything I eat and doesn’t digest well and I have a gassy stomach and my throat or esophagus burns. I also have a darker spots on my stool but I take Iron supplements so I associate it with that and I also get externe cramps and my life side below my rips it hurts so bad when I touch it. I get scared when I go places now thinking the anxiety attack will happen again. What should I do I’m always scared that I have something or a health issues every time I feel something I freak out and I start googling stuff to see if what I’m feeling is normal. I just need an advice idk what to do. I’m always in fear about my health I feel like I have some many diseases and cancers in my body and I can’t stop thinking about it. I also had excessive thirst and I am peeing every 5 mins for some weird reason."
Has anyone with anxiety overcome the fear of asking employers for references ?,pw35no,"I have the nagging sense that I might have to ask an old employer for something. I have so much anxiety about asking for references, or following up with past employers, especially ones which I did not end things with perfectly. Advice ?"
loss of appetite,pw91ip,does anyone have any tips with how to deal with this? i’m really stressed right now and anxious about everything so i’m having a hard time trying to eat. i can barely even swallow oatmeal :( anything is appreciated 😊
Tapering,pw8zhw,"Hi!
I’ve been on 1mg of clonazepam 1x a day, and a .5mg on an as needed basis for 15 years now. 

This medicine helped my agoraphobia and anxiety immensely up until a year or so ago. I guess it’s either not working anymore due to how long I’ve been on it or I need a higher dose…
I don’t want a higher dose and I honestly want to get off of this medicine. Kinda mad at myself for staying on a benzo for so long. 
I’m no longer agoraphobic but my anxiety is definitely still here. I’m sure it wouldn’t be as bad if my life wasn’t basically in shambles but ehh.. 

Any advice on tapering and/or other anti anxiety medicines that aren’t benzodiazepines?

Thanks 😊"
My heart just skipped a beat so hard,pvymy4,"It was almost painful. Now I have pain in my back/shoulders and I can’t tell if I’m having a minor panic attack because of what just happened, or if something is really wrong. Anyone else ever have a really hard skipped beat like that? I’m freaking out at the moment"
"Looking for advice, how to deal with anxiety stopping you from being productive",pw8tcl,"I have been sitting at home doing nothing for the past 6 years after i dropped out of highschool due to issues (16 back then, im 22 now) i didnt care back then because i was a kid and loved having no responsibilities and doing nothing but ive gotten to a point where all i can constantly think of is that im 22 and havent gotten anywhere in life yet and im getting scared for the future,  after years of being lazy i also built up an insane amount of anxiety , family offerd to pay for my scooter license since we live pretty deserted and scooters are a great way to get around where i live but i struggle to make myself even study and take the tests, let alone getting a job if i do manage to get the license, i remember getting an anxiety attack about 3 years ago while i was only thinking about getting a job and looking around, i spent the entire night crying not knowing what to do and it destroyed me mentally

It sickens myself that i havent gotten anywhere yet and that i am what i am right now, a part of me would love to get a job, get an income and socialize since i have been rather lonely for the past years and loneliness is what got me into a depression too, but im also scared and havent been able to make myself do anything even though i dont wanna continue living my life the way i have for the last few years

Any help is appreciated, would love to hear what helped you or someone you know if you had a similar issue"
