title,id,body
Set your intention,pvrp4s,"Happy Sunday /r/Anxiety! 

It's everyone's favorite day of the week... Sunday, the last 24 hours before Monday rears its head again. Let this thread be a space to set your intentions, share your goals and concerns, or just to check in, about the week ahead."
Monthly Check-In Thread,pviiuf,"Hello everyone! Welcome to the r/Anxiety monthly check-in thread. We hope for this to serve as casual community chat for anyone who wants to get or stay involved without having to make a full post. You can also use this as an easy way to give us feedback on what you like and don't like about the subreddit.

# Checking In

Let us know what's on your mind! This includes (but is not limited to) any significant life changes/events that have happened recently; an improvement or decrease in your mental health; any upcoming plans that you're looking forward to (or dreading); issues you're dealing with in your own local or extended community; general sources of stress or frustration in your daily life; words of advice or comfort you want to share with everyone; questions/comments/concerns you want to share with the moderators and community regarding the subreddit.

Thanks and stay safe,

The r/Anxiety Mod Team"
Getting a job sounds worse than going to Hell to me,pwj09f,"TW: self harm

I’m 19 from Boston and just graduated high school last year. I never had a job in my life until last October, where I was extremely overwhelmed. It was a pet store, so I thought I’d love the job since I love animals but it actually made me extremely sad and stressed. I was the only person on the floor, the one other guy I worked with stayed in the break room slacking off. I was doing stocking, cleaning, customer service, phone calls, cashier, and feeding the animals that’s for sale. I had to deal with the broken cash registers that the managers refused to fix. I would constantly get yelled at from customers that I was taking too long checking them out, but in reality I was waiting for the stupid computer  register to reboot which took 2-5 minutes every other customer. I barely had any training, I was trained by the slacker guy who was new and didn’t know anything he was doing. Oh also on top of all of this, I had to start training people after a week and a half in. I didn’t even know what I was doing. I worked 5 days a week, 7 hours a day. I cried every morning on the way there, and at night I’d have painful panic attacks. Three weeks later, I felt so anxious that I just refused to go to work and blocked everyone I worked with on my phone. I freaked out so much and I started to S.H.  I felt like a baby, and my family thought I was stupid for quitting. I constantly get yelled at for being “lazy” for not having a job. I’ve called them out about this and they just said I’m making excuses. About a year later and I’m doing a vet assistant program at my local cc, but I still don’t have a job. It scares me so much to think about getting stressed like that again. I just wish I had a job thats not overwhelming like the one I had. I don’t want to get to the point where I start to S.H again because of a stressful job. I want a job more than anything right now. I want to feel independent but I can’t go through that again, having anxiety so bad that I feel like I’m dying."
I need a hug 😢,pw5cyf,Can I get a hug pls 🥺
"Anyone else think about everything they have to do in a day and just mumble ""fuck"" to yourself intermittently or is it just me?",pwic7k,"Title basically.

Sometimes I'll be so worried about everything I have to do that I can't do anything at all lmao."
How do I turn down a job offer? Please help,pwi9mb,"Hi, 

Long story short, I received two job offers - one came the day before the other. I needed a job ASAP, so I accepted the first one straight away and my first day is on Wednesday. Today, I found out that I was offered another job and I am almost certain that I would prefer the second option over the first one. I don't know when my first day at the second job would be but I will attend my first day on Wednesday at the first job to get a feel of things. Maybe once I get to see how things actually are I will change my mind and decide I'm staying... Or maybe I will hate it so much that I'm going to have a hard time holding back tears? Now, if I do decide that I'm leaving, how do I tell my (scary as hell) manager that I don't want this job anymore? One part of me feels like I should just go with the first offer and decline the second one, but the other is telling me to go with whatever is going to make me happier. Why should I have to force myself to stay at a job that I hate and that makes me miserable, and decline a job that I've literally imagined myself in since I was a kid, just because I was too scared of the confrontation that would come with telling my manager about it? Should I just say something along the lines of 'I found a job that matches my areas of interest better' or 'Unfortunately, I don't think this job is the right fit for me and I'm not going to be able to perform to meet your standards', and apologise for wasting their time? 

If anyone has any advice, please let me know... I'm so stressed. 

Thanks in advance."
I posted a while ago that I was afraid of getting the vaccine.,pw714t,"https://old.reddit.com/r/Anxiety/comments/p1zn7b/too_scared_to_get_vaccinated/

I actually got my first vaccine this morning. I was meant to go to a doctor to just a chat over concerns. I told the doctor my concerns, then she had a chat with Mum and said it was better to get it over and done with today. It didn't really hurt and I feel OK afterwards."
Anyone else feel like this daily?,pwgmgu,"I have suffered with stress and anxiety for the last 10 years. My head feels funny daily like woozy, lightheaded and what not feels like there’s a tight band around my head daily, temples, eyes and back of lower head. I am guessing it’s a mixture of both, i get tension headaches where they are that bad OTC don’t work especially back of my lower head/neck. Some days my head feels that off it makes me feel like i am drunk, when i close my eyes it feels like everything is spinning and can take 2 days to get over it. Hate these feelings i get but daily it’s like i feel it all constantly mildly. Like today i can feel the tight band and when i close my eyes it feels like things are spinning a little. I do believe it’s all to do with anxiety and stress because i have had it for all these years. I really want to how i can make my head feel normal again, i am starting meds and CBT soon. Any other advice? also the tension headaches i get that are really bad and painful are only now and then"
"If caffeine fuels anxiety, then what to do instead of it?",pwb7tu,"If caffeine fuels anxiety, then what to do instead of it?"
Anyone relate?,pwm04a,"I fear stuff that I haven’t done before or don’t have a lot of experience in, no matter how small the matter may be, the mere unknown makes me so anxious. Ie Getting driver’s license, getting a credit card or paying bills and settling smt at the bank, or even just changing phones because I’m afraid my data will get lost or some stupid shit like that. 
At this point I’m beginning to think I’m just dumb, and it fuels my self hatred to the max"
I made a phone call!,pwauat,"I had to cancel an appointment and the only way to cancel was by calling. I kept postponing for days but today was the last day to do it, so I just decided to bite the bullet and made the call. It made me terrified, but the actual call lasted for less than a minute. I feel so great since I have never been able to do this before. I hope you also do something that makes you proud of yourself today! <3"
Does anyone else fear growing old not because of your own immortality but the immense pain surrounding death of loved ones?,pwl0dk,"I’m 27 and I think about death and time on the daily. I’m afraid to go into my 30’s, 40’s, etc. due to the increasing amount of people we all inevitably lose over time the longer you live and I worry that this will actually crush me into a depression I can’t get out of.

I also think about how you can lose anyone suddenly on a daily basis a lot. My brother just joined the Navy and will be stationed on a ballistic submarine for months at a time with no contact to the rest of the world. My sister was on the list for brain surgery as a toddler because she couldn’t stop having seizures and even 10 years later now we could still lose her to a seizure any day. I look at my parents and see the subtle changes of growing older of course and worry about their ailments. 

Who else feels these things on a daily basis? If so, what do you do to make light of it and move forward?"
I’m leaving Reddit to try to feel better,pvtwle,"I’ve spoken to some amazing people here and it’s been a great support network.

However I’ve realised that I’ve gotten everything I could get out of this experience and now it’s become overwhelming.

My brain wants to soak up all of the information but is drawn to negativity.

I need to leave to try and bring myself back to reality. The world isn’t as bad as my brain wants me to think.

Big surgery coming up which has really been playing on my mind. Suicidal thoughts have been hitting me hard. I need to ground myself.

I’m going to take some time off work and try to focus on more productive activities instead of social media which are a drain on me.

I would like to thank all of you. I wish you all the best in life. Anxiety disorders truly are hell to deal with.

This is my last day on Reddit then I’m signing off. 

I might revisit this in a few years time. I hope I make it out with a better life.

Much love,

Rhys

EDIT: 26/09/21 11:26pm UK time - I’m logging off 

Remember in a world this cruel, be kind ❤️"
I don't get out of the house because I feel ugly,pwgg7z,"Hi everyone. I just wanted to share some of my troubles because I don't know what else to do anymore. 

In the last few years, I started noticing my avoidance of social events because I do not feel pretty enough. I follow my daily routine of having a shower, do my hair, makeup - everything seems just fine. I don't think there is objectively anything wrong with me but then within minutes when I start dressing up my brain just switches into ""You are ugly. You can't go anywhere looking like this"" mode and that's it. I start running from one mirror to another in my house. I start checking myself from each angle. I change my clothes 5 times and then decide anyway not to go anywhere. At that moment, I just see how none of my clothes fit me well, how horrible my hair look, my makeup is weird and most importantly - my whole body just looks crooked - my big cheeks and forehead, my weird looking posture, my fat arms, acne on my cheeks ... and I just don't feel comfortable with myself. 

Do you know the uncomfortable feeling when someone is standing behind you reeeaally close and you just can't focus on anything because of a fear that the person is judging you? That's how I feel - like if someone was standing really close behind me, every time I try to leave the house. If I eventually do leave the house, I have a feeling like everyone is watching me and I just don't have the right to be outside because I do not look a certain way and am just weird. I feel ashamed of myself.

I know how irrational this might sound but right now I am sitting on my bed, after another crazy scene of running between mirrors, missing an important meeting, and not knowing what to do. Every day I think to myself - this is the last time I have done it. Tomorrow I will style myself better and everything will be fine. But what I am starting to realize is that no matter how I style my hair or how much I spend on my clothing, I will never get rid of that feeling of being ugly and not being able to leave the house. 

What am I supposed to do now? I went through many therapies and all I get are mixed diagnoses - PTSD, depression, anxiety, social anxiety, body dysmorphia - but nothing has ever helped me. Please, what can ease my life?"
Anyone else feel this way?,pwjnh0,"if i go to any big places like supermarkets, malls anywhere i aren’t used to going i start to feel lightheaded and a little woozy. Not to the point i am going to faint or fall I’ve but my head just feels weird. I’m guessing this is common with anxiety and stress. I feel like i deal with it daily but only mild and when i go to these big places or anything i feel it allot worse."
Lexapro… definitely not good for me,pwmdt6,"I started Lexapro yesterday. And I had the worst anxiety i’ve had in years. Shaking for more than 15 hours. Blood pressure very high, insomnia, headache, nausea, blood sugar very low, and dizziness. Also feeling everything unreal. My pulse wasn’t going down past 100. Today I took Clorazepate which helped me when I took it the day before Lexapro. Today I still feel nauseous, very very nervous and scared. Also dizzy.

Has anybody had Lexapro before and had all of this? I only took one dose (one pill)"
I'm gonna get kicked out of college,pwmcau,"Hi. I'm not from the US, so I don't even go to ""college"", but  yeah...Anyway, my university gives students three opportunities to pass a class and I'm already in my second try. I study computer engineering. 

I just can't put myself to work due to anxiety and that makes me even more anxious because I'm going to get kicked out...

My mother made a big effort to help me to buy my laptop to work and that makes me feel HORRIBLE because I would disappoint her so bad. I'm a mess right now. 

I just don't know how to calm down. Anxiety is ruining my life and I can't do much about it because my brain crushes me every time I try to help myself. 

What should I do. I have only two months and a half left."
Moving on from embarrassing moments/mistakes?,pwhlqx,Looking for some advice on how to let go of awkward/cringe moments! Anything helps :)
Anxiety Sunday nights,pw8bgo,"How do you all handle anxiety the night before a workday? My anxiety has gone up the roof, and I try to calm myself with some thoughts; but I feel like I’m really not doing well at work which causes my anxiety to shoot up during the weekends."
(TMI) Does anyone else wake up in the morning and vomit and/or go diarrhea right away?,pwlnbf,"I feel nauseated every morning and go diarrhea like 4 times. 

I end up taking Zofran and Imodium but it isn't supposed to be taken every day.

As soon as I wake up and my first anxious thought consumes me then boom I'm running to the bathroom.

I have been living like this for many months now. GI doctor couldn't find anything wrong and literally before the end of our appointment said ""I don't know."" 

I hate this. I have to wake up earlier than I should just to make time for this. I'm late to things when I don't."
Just visited my grandparents after not seeing them for 2 years,pwh05d,So I moved out of state haven’t seen my grandparents in 2 years would regularly call them every other day it’s been a fantastic week catching up finally seeing each other and knowing despite them being really old are In amazing health but I’m starting to feel this deep dark depression knowing I’m leaving tonight back to my house like this sadness is overtaking me I know I’m gonna see them soon again and that they’re healthy but it’s like a homesick sad feeling I’m having seeing they’re home brought back so much memories and honestly I’m confused on what I’m doing living so far away from them states away to be exact….
Does anyone else experience severe panic every time they start to fall asleep?,pwe3gk,"*my doctor has told me I do not have sleep apnea*
This has been happening to me for about a year and a half every single night, several times a night and I can not find ANY WAY to fix it and I need advice. I just want to sleep. Sometimes it just feels like a rush of extreme panic and fear and I shoot out of bed gasping for air, other times it feels like my throat is collapsing and I wake up choking, gasping for air and panicking. sometimes it feels like my heart stops and I wake up with a gasp. Most of the time it’s the throat collapse feeling accompanied by really bad panic. Does this happen to anyone else?? Any advice at all? I haven’t fallen asleep peacefully in over a year and I would do ANYTHING for one night of peaceful sleep… I know people that experience this every once in a while but I have never come across ANYONE that experiences it every single night multiple times before they can fall asleep. I can’t even find anything on the internet about this shit. I feel so alone about it…."
Does anybody get randomly anxious?,pwkmsp,"My title says it all but for example: 

After I had breakfast today, washed the dishes and was kinda just chilling for a bit when I started feeling my heart beat faster and anxiety setting in my chest and bones. Im still feeling it. 

This happens randomly when Im just kinda relaxing and I don’t know if I’m weird or it’s natural."
Has anyone else have this happen to them regarding there studies.,pwdwl1,"Basically you stay up all night worrying about whether or not your gonna get into trouble the next day for not completing an assignment or homework for wherever reasons like let's say you werent in the previous lesson.

And then you get to lesson and you find out either the teacher has set back the due date for the class giving you enough time to complete it (and you ask yourself what the hell was all that worrying about) or the teacher is not in and you have a substitute teacher and they dont ask about the homework or assignment that's due that day maybe because they didn't know or forgot and again you are relieved to have more time to complete the homework or assignment and wonder what all that stress and worry was about."
okay pls help :(,pwatue,"so i have to get the covid vaccine today in school. i do also have to get a flu nasal spray injection thing.

and i’m SO ANXIOUS. i kinda feel like i can’t breathe and i’m so shakey. i can’t stop stressing out.

pls can someone help reassure me or something? :("
Anyone feel their anxiety getting worse while on antidepressants?,pwiklc,"I'm in my second week of taking Prozac and while I'm well aware that it will take at least a few more weeks till I actually feel any effects, I just feel way more anxious in general. Like even if I'm just overly excited I'm feeling anxious about being nauseous (I'm emetophobic, and it doesn't help it's also one of the side effects of the Prozac), and even a bit of nervousness will send me into a full-blown spiral and it just doesn't go away immediately until I take Xanax.

I'm trying my absolute best not to reach for my benzos since I don't want to end up being dependent (or worse, addicted) on them, but ever since taking the Prozac it's gotten a lot easier for me to be on edge."
Does your Anxiety fluctuate at times and you don’t know what the trigger is?,pw9t6h,"I have pretty severe social anxiety. But there are periods where I am Much better  in terms of the anxiety. I’m doing the same things and taking the same medication I have always. Not sure what it is that makes me feel awful most times but some times I have confident. I’m not doing anything different. It’s like the feeling of the honeymoon period on some psychiatric medications. That feeling, But I never started a new medication. Also is my anxiety in this case more mental or chemical imbalance based, in your opinion. 

Though Anyone else get this effect at times? As in anxiety fluctuating without a reason as to why."
What comforts/soothes you when you’re anxious?,pwmqnk,"I’ve been having increased anxiety the last few weeks, talked with my primary care dr, therapist and psychiatrist to get things sorted. They all keep asking me what comforts me/soothes me/gets the good feelings flowing. They always recommend exercise, which I know is important and does provide some relief, but when I’m too far into my anxious episodes it’s hard to make that a priority. What does everyone do to comfort them? Are there any activities that you enjoy or that you find helpful? Anything weird? Idc I’m just at a loss right now at what else I can incorporate to help prevent being more anxious. Please I’d love to know your recommendations whether it’s picking up your favorite coffee/going for a drive- literally anything I will try! I’d love to know what comforts and soothes others if you want to share/feel comfortable to share. Thank you in advance for reading and hope you are all doing well!! ❤️"
Can anxiety/stress cause dizziness?,pwmqft,"When i am feeling off with it, i noticed when i feel bad because when i close my eyes my head feels like it’s spinning when it’s not. Not all the time most days i feel like i have allot of tension in my head specially lower head/neck. Which probably makes my head feel a little funny during the day. Also my head feels like it’s buzzing too."
Dentist appointment today,pwmou9,"Last night, I took 3mg of Xanax because it was the end of the work week for me as well as online exams🙌🏼
Also, today around noon (it’s 11AM where I am) I have a dentist appointment so I thought taking something the night before might make me a little bit less anxious this morning. I was wondering how much Xanax should I take before my procedure today in order to calm me down completely?? And if so, should I tell my dentist beforehand that I took something? I do get Xanax prescribed to me for my GAD and insomnia. I always get SUPER nervous at the dentist, plus super shakey and stuttering my words so I know I’m gonna have to take something. Any advice is appreciated!👏🏻👏🏻"
Weird Anxiety,pwhwm8,"I had otitis media with effusion last month. It’s an ear problem. So far I don’t have it anymore. But I developed this anxiety to certain noises like sudden creaks on the floor, door bangs, scratching noises. 

Loud noises does not affect me. It’s only when it’s silent and I hear sudden sounds regardless of volume. It makes my brain jump. It’s like a startle response but mild. It annoys me.

I don’t feel this way if i’m doing something. Or if im busy. Do you guys think i developed anxiety? I will be having my evaluation with a psychologist next week. And I don’t have an official diagnosis yet. 

It seems im anxious when there is no background noise. The initial burst of sound I hear “stings” my mind. It feels like it zaps my brain. But succeeding noises won’t bother me anymore. Weird. It’s only when it’s already silent for a few moments then when I hear a sound, it startles me…"
Dentist in 1 hour,pwmkmc,Idk why these things give me anxiety but do u think the dentist would call if my appointment got canceled bc I didn’t do what I was supposed to before coming? 😥😥😥
"Bats,anxiety",pwmgs3,Ugh I’ve struggled for so long with the same subject. Bats and rabies. About a month ago I was just stepping out of the car at night and something scratched my elbow. (I’m pretty sure I scratched myself on this sharp edge near my seatbelt). Anyways my mind says it’s a bat. Never saw one. But what if I didn’t look? I’ve been living in fear for a month now can’t get this off my mind. My parents laugh at me and everyone I say it to laughs at me. I’ve had this fear of bats for abt 6 months now. I just don’t know what to do. What if it was a bat? And what if it had rabies? My elbow had a TINY mark when I came inside with a TINY little mark of pealed skin. Took a shower then nothing was there. Just very worried
Anyone else get tension headaches all the time?,pwmg83,"My neck/lower head always feels tense like there’s a band around it and my temples and eyes at times. Like a daily feeling but some days the tension gets too much and causes me bad pain after a few days it eventually goes. Probably why my head feels weird daily like, lightheaded and woozy at times."
Is a pulse of 151 normal during an anxiety episode?,pwmf38,"I have pretty bad health anxiety lately.

I was getting my blood pressure done, and it was pretty normal I think (121/83) but the pulse said “151” and I’m guessing that’s bpm?
I thought that was crazy high. 
But I was having intense anxiety about the blood pressure thing for some reason. I felt my heart rate beating during this like it normally would during anxiety. 
I went home and downloaded an app to track my pulse, and it’s been normal since. 

Do you guys get very high heart rates during anxiety too? Have you ever tracked it? 
I’m thinking of getting a fit bit just to track my heart rate."
Anxiety around suicide,pwment,"As the title says I think iv developed like anxiety around suicide as I took a antidepressant called prozac and 2 days in had suicidal thoughts every time I think about it I go mad in the past few days well I had a thought of hanging myself in my local woods (I'm no danger to myself I don't want to act on this and if I doi know who to call as deep down I love to live and dying is my worst fear) anyways this thought did scare the s**t outta me one night then every day after it was the same thought and I don't know if iv got depression now either but when I think oh idk if it can but prozac has given me chronic suicidal thoughts or I'm never gonna lose these or no  one can help me that last one sounds like depression but the thing is I'm not even diagnosed with depression and it all started after u took prozac that's y I'm so worked up about it the other thing is can anxiety make you like have thoughts over and over 

Thanks to anyone reading and sorry if it triggerd you"
